{
  "name": "github-mcp-server",
  "description": "MCP server providing GitHub API access for issue management, PRs, and code search",
  "version": "2.1.0",
  "protocols": ["mcp"],
  "transport": { "type": "stdio" },
  "tools": [
    { "name": "search_issues", "description": "Search GitHub issues", "free": true },
    { "name": "create_pr", "description": "Create a pull request", "free": true },
    { "name": "review_code", "description": "AI-powered code review", "free": false }
  ],
  "packages": [{
    "registryType": "npm",
    "registryBaseUrl": "https://registry.npmjs.org",
    "identifier": "@modelcontextprotocol/server-github",
    "version": "2.1.0"
  }],
  "repository": { "url": "https://github.com/modelcontextprotocol/servers", "source": "github" },
  "license": "MIT"
}
